{"schema_version":"1.0","id":"generic-fuzz-target","name":"Generic seeded fuzz target","requirements":[{"id":"REQ-NO-ABNORMAL-EXIT","description":"The guarded operation should not terminate abnormally.","type":"safety"}],"functions":[{"id":"FUNC-GUARDED","name":"guarded_operation","file":"src/guarded.c","requirement_ids":["REQ-NO-ABNORMAL-EXIT"]}],"tests":[{"id":"TEST-GUARDED-SMOKE","function_id":"FUNC-GUARDED","requirement_ids":["REQ-NO-ABNORMAL-EXIT"],"kind":"unit","input":{"args":{"value":0}},"expected":{"no_crash":true}}]}
