{"schema_version":"1.0","id":"counter","name":"Counter states","variables":[{"id":"count","domain":{"type":"integer","minimum":0,"maximum":2},"initial":0}],"states":[{"id":"zero","initial":true,"values":{"count":0}},{"id":"one","values":{"count":1}},{"id":"two","values":{"count":2}}],"transitions":[{"id":"increment-0","source":"zero","target":"one"},{"id":"increment-1","source":"one","target":"two"}]}
