{"schema_version":"1.0","id":"generic-dynamic-outcomes","name":"Generic dynamic test outcomes","requirements":[{"id":"REQ-DYNAMIC","description":"Function observations match each declared oracle.","type":"functional"}],"functions":[{"id":"FUNC-IDENTITY","name":"identity_value","file":"src/operations.c","requirement_ids":["REQ-DYNAMIC"]},{"id":"FUNC-WAIT","name":"wait_for_negative","file":"src/operations.c","requirement_ids":["REQ-DYNAMIC"]}],"tests":[{"id":"TEST-ORACLE-PASS","function_id":"FUNC-IDENTITY","requirement_ids":["REQ-DYNAMIC"],"kind":"unit","input":{"args":{"value":8}},"expected":{"return_value":8}},{"id":"TEST-ORACLE-FAIL","function_id":"FUNC-IDENTITY","requirement_ids":["REQ-DYNAMIC"],"kind":"unit","input":{"args":{"value":4}},"expected":{"return_value":99}},{"id":"TEST-TIMEOUT","function_id":"FUNC-WAIT","requirement_ids":["REQ-DYNAMIC"],"kind":"unit","input":{"args":{"value":-1}},"expected":{"return_value":-1}},{"id":"TEST-BUILD-FAIL","requirement_ids":["REQ-DYNAMIC"],"kind":"unit","input":{"target":"build_failure_value","args":{"value":1,"build_failure":1}},"expected":{"return_value":1}}]}
