{"schema_version":"1.0","id":"generic-cpp-scale","name":"Generic C++ scale function","requirements":[{"id":"REQ-SCALE","description":"Scaling multiplies the supplied value and factor.","type":"functional"}],"functions":[{"id":"FUNC-SCALE","name":"scale_value","file":"src/numeric.cpp","requirement_ids":["REQ-SCALE"]}],"tests":[{"id":"TEST-SCALE","function_id":"FUNC-SCALE","requirement_ids":["REQ-SCALE"],"kind":"unit","input":{"args":{"value":6,"factor":7}},"expected":{"return_value":42}}]}
