{"schema_version":"1.0","id":"generic-bounded-reachability","name":"Generic bounded reachability","initial_state":"START","requirements":[{"id":"REQ-BOUNDED-TRACE","description":"The terminal state is reachable within two transitions.","type":"safety","property_ids":["PROP-TERMINAL-BOUND"]},{"id":"REQ-BOUNDED-COMPLETE","description":"The terminal label is reachable by the complete finite bound.","type":"safety","property_ids":["PROP-ALARM-COMPLETE"]}],"states":[{"id":"START","initial":true,"labels":["safe"]},{"id":"MIDDLE","labels":["safe"]},{"id":"TERMINAL","labels":["terminal","safe"]}],"transitions":[{"id":"STEP-1","source":"START","target":"MIDDLE"},{"id":"STEP-2","source":"MIDDLE","target":"TERMINAL"},{"id":"HOLD","source":"TERMINAL","target":"TERMINAL"}],"properties":[{"id":"PROP-TERMINAL-SHALLOW","logic":"BMC","formula":"terminal","bound":1,"requirement_ids":["REQ-BOUNDED-TRACE"]},{"id":"PROP-TERMINAL-BOUND","logic":"BMC","formula":"terminal","bound":2,"requirement_ids":["REQ-BOUNDED-TRACE"]},{"id":"PROP-ALARM-COMPLETE","logic":"BMC","formula":"terminal","bound":2,"requirement_ids":["REQ-BOUNDED-COMPLETE"]}]}
