{"schema_version":"1.0","id":"bounded","name":"Bounded transition graph","variables":[{"id":"step","domain":{"type":"integer","minimum":0,"maximum":3},"initial":0}],"states":[{"id":"step-0","initial":true,"values":{"step":0}},{"id":"step-1","values":{"step":1}},{"id":"step-2","values":{"step":2}},{"id":"step-3","values":{"step":3}}],"transitions":[{"id":"advance-0","source":"step-0","target":"step-1"},{"id":"advance-1","source":"step-1","target":"step-2"},{"id":"advance-2","source":"step-2","target":"step-3"}]}
