{"schema_version":"1.0","id":"generic-full-verification","name":"Generic full verification example","initial_state":"READY","requirements":[{"id":"REQ-READY-SAFE","description":"The finite model stays in the safe ready state.","type":"safety","property_ids":["PROP-CTL-SAFE","PROP-BMC-NO-FAULT"]},{"id":"REQ-INCREMENT","description":"Nonnegative inputs increment by one.","type":"functional","property_ids":["PROP-SMT-RANGE"]},{"id":"REQ-DYNAMIC-INCREMENT","description":"The increment function returns one above its input.","type":"functional"}],"variables":[{"id":"value","domain":{"type":"integer","minimum":0,"maximum":10},"initial":0}],"states":[{"id":"READY","initial":true,"labels":["safe"]}],"transitions":[{"id":"READY-LOOP","source":"READY","target":"READY"}],"properties":[{"id":"PROP-CTL-SAFE","logic":"CTL","formula":"AG(safe)","requirement_ids":["REQ-READY-SAFE"]},{"id":"PROP-BMC-NO-FAULT","logic":"BMC","formula":"fault","bound":0,"requirement_ids":["REQ-READY-SAFE"]},{"id":"PROP-SMT-RANGE","logic":"SMT","formula":"value >= 0 && value <= 10","requirement_ids":["REQ-INCREMENT"]}],"functions":[{"id":"FUNC-INCREMENT","name":"increment_value","file":"src/counter.c","requirement_ids":["REQ-DYNAMIC-INCREMENT"]}],"tests":[{"id":"TEST-INCREMENT-4","function_id":"FUNC-INCREMENT","requirement_ids":["REQ-DYNAMIC-INCREMENT"],"kind":"unit","input":{"args":{"value":4}},"expected":{"return_value":5}}]}
