{"schema_version":"1.0","id":"generic-workflow-machine","name":"Generic workflow machine","initial_state":"IDLE","requirements":[{"id":"REQ-COMPLETE-REACHABLE","description":"The complete state is reachable from idle.","type":"liveness","property_ids":["PROP-COMPLETE-REACHABLE"]},{"id":"REQ-FAILURE-ABSENT","description":"The safe label holds across this finite model.","type":"safety","property_ids":["PROP-FAILURE-ABSENT"]}],"states":[{"id":"IDLE","initial":true,"labels":["safe"]},{"id":"ACTIVE","labels":["safe"]},{"id":"COMPLETE","labels":["done","safe"]}],"transitions":[{"id":"START","source":"IDLE","target":"ACTIVE"},{"id":"FINISH","source":"ACTIVE","target":"COMPLETE"},{"id":"WAIT","source":"COMPLETE","target":"COMPLETE"}],"properties":[{"id":"PROP-COMPLETE-REACHABLE","logic":"CTL","formula":"EF(done)","requirement_ids":["REQ-COMPLETE-REACHABLE"]},{"id":"PROP-FAILURE-ABSENT","logic":"CTL","formula":"AG(safe)","requirement_ids":["REQ-FAILURE-ABSENT"]}]}
