{"schema_version":"1.0","id":"generic-branch-coverage","name":"Generic branch coverage","requirements":[{"id":"REQ-CLASSIFICATION","description":"Positive values and nonpositive values use distinct branches.","type":"functional"}],"functions":[{"id":"FUNC-CLASSIFY","name":"classify_value","file":"src/branching.c","requirement_ids":["REQ-CLASSIFICATION"]}],"tests":[{"id":"TEST-POSITIVE","function_id":"FUNC-CLASSIFY","requirement_ids":["REQ-CLASSIFICATION"],"kind":"unit","input":{"args":{"value":5}},"expected":{"return_value":1}},{"id":"TEST-NEGATIVE-WRONG-ORACLE","function_id":"FUNC-CLASSIFY","requirement_ids":["REQ-CLASSIFICATION"],"kind":"unit","input":{"args":{"value":-5}},"expected":{"return_value":99}}]}
